{
  "$schema": "https://json-schema.org/draft/2020-12/schema",
  "$id": "https://gann-astro-desk.local/schemas/machine-assisted-experimental-market-hypothesis-registry-s2r1-r1-v1.json",
  "title": "MO-R4A-S2R1-R1 Saravali-Adjudicated Blinded Market Bridge Hypothesis Registry",
  "type": "object",
  "additionalProperties": false,
  "required": [
    "contract",
    "schemaVersion",
    "registryId",
    "registryStatus",
    "purpose",
    "entryPolicy",
    "startingMaster",
    "historicalS2R1RegistryHash",
    "historicalS2R1PredictionFreezeHash",
    "sourceAdjudicationReason",
    "upstreamSourceLedgerContract",
    "upstreamSourceLedgerHash",
    "upstreamCoverageContract",
    "upstreamCoverageHash",
    "hypothesisFamilyId",
    "entries",
    "guardrails",
    "registryHash"
  ],
  "properties": {
    "contract": {
      "const": "MACHINE_ASSISTED_EXPERIMENTAL_MARKET_HYPOTHESIS_REGISTRY_S2R1_R1_V1"
    },
    "schemaVersion": {
      "const": 1
    },
    "registryId": {
      "type": "string",
      "minLength": 1
    },
    "registryStatus": {
      "const": "AUTHORIZED_FOR_BLINDED_SUCCESSOR_REFREEZE"
    },
    "purpose": {
      "type": "string",
      "minLength": 1
    },
    "entryPolicy": {
      "type": "string",
      "minLength": 1
    },
    "startingMaster": {
      "const": "a620ae4a33b7455087aee7a4ded296d60b7ae450"
    },
    "upstreamSourceLedgerContract": {
      "const": "MO_R4A_S2R1_R1_SARAVALI_ADJUDICATED_CLASSICAL_SOURCE_OPERATOR_LEDGER_V1"
    },
    "upstreamSourceLedgerHash": {
      "$ref": "#/$defs/sha256"
    },
    "upstreamCoverageContract": {
      "const": "MO_R4A_S2R1_R1_REAL_24_SOURCE_OPERATOR_COVERAGE_V1"
    },
    "upstreamCoverageHash": {
      "$ref": "#/$defs/sha256"
    },
    "hypothesisFamilyId": {
      "const": "MO_R4A_S2R1_R1_COMPOUND_RELATIONSHIP_DIRECT_VALENCE_V1"
    },
    "entries": {
      "type": "array",
      "minItems": 2,
      "maxItems": 2,
      "items": {
        "$ref": "#/$defs/hypothesis"
      }
    },
    "guardrails": {
      "$ref": "#/$defs/guardrails"
    },
    "registryHash": {
      "$ref": "#/$defs/sha256"
    },
    "historicalS2R1RegistryHash": {
      "$ref": "#/$defs/sha256"
    },
    "historicalS2R1PredictionFreezeHash": {
      "$ref": "#/$defs/sha256"
    },
    "sourceAdjudicationReason": {
      "type": "string",
      "minLength": 1
    }
  },
  "$defs": {
    "sha256": {
      "type": "string",
      "pattern": "^[A-F0-9]{64}$"
    },
    "hypothesis": {
      "type": "object",
      "additionalProperties": false,
      "required": [
        "hypothesisFamilyId",
        "hypothesisId",
        "version",
        "author",
        "createdAtUtc",
        "hypothesisScope",
        "bridgeBasis",
        "inputOperatorIds",
        "primaryInputOperatorId",
        "primaryInputOperatorVersion",
        "stateMap",
        "targetSide",
        "applicabilityPolicy",
        "abstentionPolicy",
        "sourceClaim",
        "experimentalClaim",
        "reasoning",
        "sourceDependencies",
        "experimentalAssumptions",
        "prohibitedGeneralizations",
        "validationStatus",
        "outcomeDataSeenAtCreation",
        "approvalStatus",
        "signedUnitIfConfigured",
        "magnitudeConfigured",
        "mode",
        "productionAdmission",
        "supersedesHypothesisId",
        "supersedesHypothesisHash",
        "sourceAdjudicationReason",
        "newUpstreamSourceLedgerHash",
        "newUpstreamCoverageHash",
        "hypothesisHash"
      ],
      "properties": {
        "hypothesisFamilyId": {
          "const": "MO_R4A_S2R1_R1_COMPOUND_RELATIONSHIP_DIRECT_VALENCE_V1"
        },
        "hypothesisId": {
          "enum": [
            "H-MO-S2R1-R1-COMPOUND-REL-DIRECT-USD-V1",
            "H-MO-S2R1-R1-COMPOUND-REL-DIRECT-JPY-V1"
          ]
        },
        "version": {
          "const": "1"
        },
        "author": {
          "type": "string",
          "minLength": 1
        },
        "createdAtUtc": {
          "type": "string",
          "pattern": "Z$"
        },
        "hypothesisScope": {
          "const": "FROZEN_24_EVENT_OUTCOME_BLIND_CURRENCY_SIDE_PILOT"
        },
        "bridgeBasis": {
          "const": "SOURCE_OPERATOR_STATE_PREDICATE"
        },
        "inputOperatorIds": {
          "const": [
            "BJ_SARAVALI_COMPOUND_RELATIONSHIP_V1"
          ]
        },
        "primaryInputOperatorId": {
          "const": "BJ_SARAVALI_COMPOUND_RELATIONSHIP_V1"
        },
        "primaryInputOperatorVersion": {
          "const": "1"
        },
        "stateMap": {
          "type": "object",
          "additionalProperties": false,
          "required": [
            "GREAT_FRIEND",
            "FRIEND",
            "NEUTRAL",
            "ENEMY",
            "GREAT_ENEMY"
          ],
          "properties": {
            "GREAT_FRIEND": {
              "const": "SUPPORTIVE"
            },
            "FRIEND": {
              "const": "SUPPORTIVE"
            },
            "NEUTRAL": {
              "const": "NEUTRAL"
            },
            "ENEMY": {
              "const": "ADVERSE"
            },
            "GREAT_ENEMY": {
              "const": "ADVERSE"
            }
          }
        },
        "targetSide": {
          "enum": [
            "USD",
            "JPY"
          ]
        },
        "applicabilityPolicy": {
          "const": "SOURCE_CLOSED_MACHINE_EVALUATED_COMPOUND_RELATIONSHIP_ONLY"
        },
        "abstentionPolicy": {
          "type": "object",
          "additionalProperties": false,
          "required": [
            "currencyPressureState",
            "bridgeApplied",
            "fallbackOperatorAllowed"
          ],
          "properties": {
            "currencyPressureState": {
              "const": "UNKNOWN_MORE_EVIDENCE_REQUIRED"
            },
            "bridgeApplied": {
              "const": false
            },
            "fallbackOperatorAllowed": {
              "const": false
            }
          }
        },
        "sourceClaim": {
          "type": "string",
          "minLength": 1
        },
        "experimentalClaim": {
          "type": "string",
          "minLength": 1
        },
        "reasoning": {
          "type": "string",
          "minLength": 1
        },
        "sourceDependencies": {
          "$ref": "#/$defs/nonEmptyTextArray"
        },
        "experimentalAssumptions": {
          "$ref": "#/$defs/nonEmptyTextArray"
        },
        "prohibitedGeneralizations": {
          "$ref": "#/$defs/nonEmptyTextArray"
        },
        "validationStatus": {
          "const": "NOT_FINANCIALLY_VALIDATED"
        },
        "outcomeDataSeenAtCreation": {
          "const": false
        },
        "approvalStatus": {
          "const": "AUTHORIZED_FOR_BLINDED_TEST"
        },
        "signedUnitIfConfigured": {
          "const": null
        },
        "magnitudeConfigured": {
          "const": false
        },
        "mode": {
          "const": "EXPERIMENTAL_PROFILED"
        },
        "productionAdmission": {
          "const": false
        },
        "hypothesisHash": {
          "$ref": "#/$defs/sha256"
        },
        "supersedesHypothesisId": {
          "enum": [
            "H-MO-S2R1-COMPOUND-REL-DIRECT-USD-V1",
            "H-MO-S2R1-COMPOUND-REL-DIRECT-JPY-V1"
          ]
        },
        "supersedesHypothesisHash": {
          "$ref": "#/$defs/sha256"
        },
        "sourceAdjudicationReason": {
          "type": "string",
          "minLength": 1
        },
        "newUpstreamSourceLedgerHash": {
          "$ref": "#/$defs/sha256"
        },
        "newUpstreamCoverageHash": {
          "$ref": "#/$defs/sha256"
        }
      }
    },
    "nonEmptyTextArray": {
      "type": "array",
      "minItems": 1,
      "items": {
        "type": "string",
        "minLength": 1
      }
    },
    "guardrails": {
      "type": "object",
      "additionalProperties": false,
      "required": [
        "priceDataRead",
        "outcomeDataRead",
        "founderDecisionRead",
        "reviewStoreRead",
        "sbcRead",
        "catalogueAdmission",
        "evidenceAdmission",
        "signedWaveRendered",
        "pairResultantCreated",
        "magnitudeConfigured",
        "autoSuggestEnabled",
        "mlEnabled",
        "mt5Enabled",
        "executionAllowed"
      ],
      "properties": {
        "priceDataRead": {
          "const": false
        },
        "outcomeDataRead": {
          "const": false
        },
        "founderDecisionRead": {
          "const": false
        },
        "reviewStoreRead": {
          "const": false
        },
        "sbcRead": {
          "const": false
        },
        "catalogueAdmission": {
          "const": false
        },
        "evidenceAdmission": {
          "const": false
        },
        "signedWaveRendered": {
          "const": false
        },
        "pairResultantCreated": {
          "const": false
        },
        "magnitudeConfigured": {
          "const": false
        },
        "autoSuggestEnabled": {
          "const": false
        },
        "mlEnabled": {
          "const": false
        },
        "mt5Enabled": {
          "const": false
        },
        "executionAllowed": {
          "const": false
        }
      }
    }
  }
}
